{
  "slug": "initial-d",
  "name": "Initial D",
  "match": [
    "initial-d"
  ],
  "isLight": false,
  "terminal": {
    "background": "#08182a"
  },
  "avatar": {
    "family": "initial-d",
    "skin": {
      "primary": "#d2e04e",
      "bright": "#f4eeda",
      "body": "#1f5068",
      "shadow": "#122f48",
      "dim": "#6f9fb8",
      "cyan": "#ffb52e",
      "alert": "#ff4d3d",
      "value": "#f29a8e",
      "tint": "#0c2236",
      "ink": "#06121f"
    }
  },
  "flow": {
    "palette": {
      "bg": "#08182a",
      "page": "#08182a",
      "fg": "#f4eeda",
      "text2": "#b9cad0",
      "text3": "#a3b8c2",
      "text4": "#8fa8b4",
      "border": "#203e58",
      "cardBorder": "#3f6a88",
      "track": "#17344c",
      "select": "#122c44",
      "cyan": "#5fa6c0",
      "green": "#5fae7b",
      "yellow": "#d2e04e",
      "orange": "#f2a65e",
      "red": "#ff4d3d",
      "blue": "#7fb6d6",
      "violet": "#f08fa0",
      "railDone": "#2f7890",
      "railRun": "#8a9632",
      "tabActive": "#ffb52e"
    },
    "steps": {
      "header": { "style": "bracketed", "prefix": "STAGE // ", "color": "yellow", "frame": "cardBorder", "upper": true },
      "layout": "path",
      "meter": { "style": "bar", "fill": "━", "empty": "┄" },
      "states": {
        "done": { "glyph": "⚑", "color": "cyan", "labelColor": "text2", "bold": false, "rail": "┃", "railColor": "railDone" },
        "active": { "glyph": "◴", "color": "yellow", "labelColor": "fg", "bold": true, "rail": "┇", "railColor": "railRun", "ground": "select" },
        "pending": { "glyph": "○", "color": "text4", "bold": false, "rail": "┆", "railColor": "border" },
        "blocked": { "glyph": "✕", "color": "red", "bold": true, "rail": "┆", "railColor": "border" }
      },
      "cycle": { "glyphs": [ "◴", "◷", "◶", "◵" ], "ms": 300 },
      "captions": { "title": "downhill", "active": "drifting", "blocked": "road closed", "optional": "side road", "progress": "corner {i} of {n} · {left} to go", "idle": "engine idling · {left} to go" }
    }
  },
  "spinner": {
    "frames": ["◴", "◷", "◶", "◵"],
    "ms": 120,
    "verbs": [
      "Drifting",
      "Running the gutter",
      "Delivering tofu",
      "Not spilling the cup of water",
      "Heel-and-toeing",
      "Clipping the hairpin",
      "Charging downhill",
      "Feathering the throttle",
      "Counter-steering",
      "Popping the headlights",
      "Chasing tail lights",
      "Hugging the guard rail",
      "Braking late",
      "Rev-matching",
      "Cueing the eurobeat",
      "Warming the tyres"
    ]
  }
}
